<?xml version="1.0" encoding="UTF-8"?>
<DICOM_SR DateTimeEnd="" DateTimeStart="" IDOntology="" IDReport="" IDTRENCADISReport="" xmlns:xsi="http://www.w3.org/2001/XMLSchema-instance" xsi:noNamespaceSchemaLocation="../xsd/report.xsd">
  <CONTAINER>
    <CONCEPT_NAME>
      <CODE_VALUE>CODE_VALUE</CODE_VALUE>
      <CODE_SCHEMA>CODE_SCHEMA</CODE_SCHEMA>
      <CODE_MEANING>CODE_MEANING</CODE_MEANING>
      <CODE_MEANING2>CODE_MEANING2</CODE_MEANING2>
    </CONCEPT_NAME>
    <CHILDREN>
      <TEXT>
        <CONCEPT_NAME>
          <CODE_VALUE>CODE_VALUE</CODE_VALUE>
          <CODE_SCHEMA>CODE_SCHEMA</CODE_SCHEMA>
          <CODE_MEANING>CODE_MEANING</CODE_MEANING>
          <CODE_MEANING2>CODE_MEANING2</CODE_MEANING2>
        </CONCEPT_NAME>
        <VALUE>VALUE</VALUE>
      </TEXT>
      <DATE>
        <CONCEPT_NAME>
          <CODE_VALUE>CODE_VALUE</CODE_VALUE>
          <CODE_SCHEMA>CODE_SCHEMA</CODE_SCHEMA>
          <CODE_MEANING>CODE_MEANING</CODE_MEANING>
          <CODE_MEANING2>CODE_MEANING2</CODE_MEANING2>
        </CONCEPT_NAME>
        <VALUE>VALUE</VALUE>
      </DATE>
      <CONTAINER>
        <CONCEPT_NAME>
          <CODE_VALUE>CODE_VALUE</CODE_VALUE>
          <CODE_SCHEMA>CODE_SCHEMA</CODE_SCHEMA>
          <CODE_MEANING>CODE_MEANING</CODE_MEANING>
          <CODE_MEANING2>CODE_MEANING2</CODE_MEANING2>
        </CONCEPT_NAME>
        <CHILDREN>
          <TEXT>
            <CONCEPT_NAME>
              <CODE_VALUE>CODE_VALUE</CODE_VALUE>
              <CODE_SCHEMA>CODE_SCHEMA</CODE_SCHEMA>
              <CODE_MEANING>CODE_MEANING</CODE_MEANING>
              <CODE_MEANING2>CODE_MEANING2</CODE_MEANING2>
            </CONCEPT_NAME>
            <VALUE>VALUE</VALUE>
          </TEXT>
          <CODE>
            <CONCEPT_NAME>
              <CODE_VALUE>CODE_VALUE</CODE_VALUE>
              <CODE_SCHEMA>CODE_SCHEMA</CODE_SCHEMA>
              <CODE_MEANING>CODE_MEANING</CODE_MEANING>
              <CODE_MEANING2>CODE_MEANING2</CODE_MEANING2>
            </CONCEPT_NAME>
            <VALUE>
              <CODE_VALUE>CODE_VALUE</CODE_VALUE>
              <CODE_SCHEMA>CODE_SCHEMA</CODE_SCHEMA>
              <CODE_MEANING>CODE_MEANING</CODE_MEANING>
              <CODE_MEANING2>CODE_MEANING2</CODE_MEANING2>
            </VALUE>
          </CODE>
          <NUM>
            <CONCEPT_NAME>
              <CODE_VALUE>CODE_VALUE</CODE_VALUE>
              <CODE_SCHEMA>CODE_SCHEMA</CODE_SCHEMA>
              <CODE_MEANING>CODE_MEANING</CODE_MEANING>
              <CODE_MEANING2>CODE_MEANING2</CODE_MEANING2>
            </CONCEPT_NAME>
            <UNIT_MEASUREMENT>
              <CODE_VALUE>CODE_VALUE</CODE_VALUE>
              <CODE_SCHEMA>CODE_SCHEMA</CODE_SCHEMA>
              <CODE_MEANING>CODE_MEANING</CODE_MEANING>
              <CODE_MEANING2>CODE_MEANING2</CODE_MEANING2>
            </UNIT_MEASUREMENT>
            <VALUE>VALUE</VALUE>
          </NUM>
          <CONTAINER>
            <CONCEPT_NAME>
              <CODE_VALUE>CODE_VALUE</CODE_VALUE>
              <CODE_SCHEMA>CODE_SCHEMA</CODE_SCHEMA>
              <CODE_MEANING>CODE_MEANING</CODE_MEANING>
              <CODE_MEANING2>CODE_MEANING2</CODE_MEANING2>
            </CONCEPT_NAME>
            <CHILDREN>
              <TEXT>
                <CONCEPT_NAME>
                  <CODE_VALUE>CODE_VALUE</CODE_VALUE>
                  <CODE_SCHEMA>CODE_SCHEMA</CODE_SCHEMA>
                  <CODE_MEANING>CODE_MEANING</CODE_MEANING>
                  <CODE_MEANING2>CODE_MEANING2</CODE_MEANING2>
                </CONCEPT_NAME>
                <VALUE>VALUE</VALUE>
              </TEXT>
              <CODE>
                <CONCEPT_NAME>
                  <CODE_VALUE>CODE_VALUE</CODE_VALUE>
                  <CODE_SCHEMA>CODE_SCHEMA</CODE_SCHEMA>
                  <CODE_MEANING>CODE_MEANING</CODE_MEANING>
                  <CODE_MEANING2>CODE_MEANING2</CODE_MEANING2>
                </CONCEPT_NAME>
                <VALUE>
                  <CODE_VALUE>CODE_VALUE</CODE_VALUE>
                  <CODE_SCHEMA>CODE_SCHEMA</CODE_SCHEMA>
                  <CODE_MEANING>CODE_MEANING</CODE_MEANING>
                  <CODE_MEANING2>CODE_MEANING2</CODE_MEANING2>
                </VALUE>
              </CODE>
              <NUM>
                <CONCEPT_NAME>
                  <CODE_VALUE>CODE_VALUE</CODE_VALUE>
                  <CODE_SCHEMA>CODE_SCHEMA</CODE_SCHEMA>
                  <CODE_MEANING>CODE_MEANING</CODE_MEANING>
                  <CODE_MEANING2>CODE_MEANING2</CODE_MEANING2>
                </CONCEPT_NAME>
                <UNIT_MEASUREMENT>
                  <CODE_VALUE>CODE_VALUE</CODE_VALUE>
                  <CODE_SCHEMA>CODE_SCHEMA</CODE_SCHEMA>
                  <CODE_MEANING>CODE_MEANING</CODE_MEANING>
                  <CODE_MEANING2>CODE_MEANING2</CODE_MEANING2>
                </UNIT_MEASUREMENT>
                <VALUE>VALUE</VALUE>
              </NUM>
              <CONTAINER>
                <CONCEPT_NAME>
                  <CODE_VALUE>CODE_VALUE</CODE_VALUE>
                  <CODE_SCHEMA>CODE_SCHEMA</CODE_SCHEMA>
                  <CODE_MEANING>CODE_MEANING</CODE_MEANING>
                  <CODE_MEANING2>CODE_MEANING2</CODE_MEANING2>
                </CONCEPT_NAME>
                <CHILDREN>
                  <TEXT>
                    <CONCEPT_NAME>
                      <CODE_VALUE>CODE_VALUE</CODE_VALUE>
                      <CODE_SCHEMA>CODE_SCHEMA</CODE_SCHEMA>
                      <CODE_MEANING>CODE_MEANING</CODE_MEANING>
                      <CODE_MEANING2>CODE_MEANING2</CODE_MEANING2>
                    </CONCEPT_NAME>
                    <VALUE>VALUE</VALUE>
                  </TEXT>
                  <CODE>
                    <CONCEPT_NAME>
                      <CODE_VALUE>CODE_VALUE</CODE_VALUE>
                      <CODE_SCHEMA>CODE_SCHEMA</CODE_SCHEMA>
                      <CODE_MEANING>CODE_MEANING</CODE_MEANING>
                      <CODE_MEANING2>CODE_MEANING2</CODE_MEANING2>
                    </CONCEPT_NAME>
                    <VALUE>
                      <CODE_VALUE>CODE_VALUE</CODE_VALUE>
                      <CODE_SCHEMA>CODE_SCHEMA</CODE_SCHEMA>
                      <CODE_MEANING>CODE_MEANING</CODE_MEANING>
                      <CODE_MEANING2>CODE_MEANING2</CODE_MEANING2>
                    </VALUE>
                  </CODE>
                  <NUM>
                    <CONCEPT_NAME>
                      <CODE_VALUE>CODE_VALUE</CODE_VALUE>
                      <CODE_SCHEMA>CODE_SCHEMA</CODE_SCHEMA>
                      <CODE_MEANING>CODE_MEANING</CODE_MEANING>
                      <CODE_MEANING2>CODE_MEANING2</CODE_MEANING2>
                    </CONCEPT_NAME>
                    <UNIT_MEASUREMENT>
                      <CODE_VALUE>CODE_VALUE</CODE_VALUE>
                      <CODE_SCHEMA>CODE_SCHEMA</CODE_SCHEMA>
                      <CODE_MEANING>CODE_MEANING</CODE_MEANING>
                      <CODE_MEANING2>CODE_MEANING2</CODE_MEANING2>
                    </UNIT_MEASUREMENT>
                    <VALUE>VALUE</VALUE>
                  </NUM>
                </CHILDREN>
              </CONTAINER>
            </CHILDREN>
          </CONTAINER>
        </CHILDREN>
      </CONTAINER>
    </CHILDREN>
  </CONTAINER>
</DICOM_SR>
